<?xml version="1.0"?>

<calendario xmlns:xsi="http://www.w3.org/2001/XMLSchema-instance"
xsi:noNamespaceSchemaLocation="calendario.xsd">
    <trimestre numero="primero">
        <asignatura>
            <nombre>LLMM</nombre> <!-- min 1 max 6-->
            <tema numero="4"> <!-- min 1 max 10-->
                <nombre>RSS</nombre>
                <notamedia>
                    <teoria>8,4</teoria> <!-- min 2 max 10-->
                    <practica>7,7</practica> <!-- min 2 max 10-->
                </notamedia>
            </tema>
            <fechasexamenes>2021/03/07</fechasexamenes> <!-- numero indefinido (unbounded)-->
        </asignatura>
    </trimestre>
</calendario>